{
  "schemaVersion": 1,
  "origin": "https://chatgpt.com",
  "adapterVersion": 1,
  "engineVersion": 1,
  "composer": {
    "selectors": [
      "#prompt-textarea",
      "div#prompt-textarea.ProseMirror",
      "[data-testid=\"prompt-textarea\"]",
      "[contenteditable=\"true\"][role=\"textbox\"]",
      "form [contenteditable=\"true\"]"
    ]
  },
  "send": {
    "selectors": [
      "button#composer-submit-button",
      "button[data-testid=\"send-button\"]",
      "button[data-testid=\"fruitjuice-send-button\"]",
      "button[aria-label=\"Send prompt\"]",
      "button[type=\"submit\"]"
    ]
  },
  "response": {
    "turnSelectors": [
      "[data-message-author-role=\"assistant\"]",
      "[data-turn=\"assistant\"]",
      "article[data-turn=\"assistant\"]"
    ],
    "contentSelectors": [],
    "excludeSelectors": []
  },
  "completion": {
    "stopSelectors": [
      "button[data-testid=\"stop-button\"]",
      "button[aria-label=\"Stop streaming\"]",
      "button[aria-label*=\"Stop\"]"
    ],
    "progressSelectors": []
  }
}
